id,text,label,variant,source_dataset,generator_model,attack_type,domain,group_id,split,metadata
25973388-beeb-4f0b-b1e9-e1573361cf36,"Jef Raskin, head of the team behind the first Macintosh computer, has died. Mr Raskin was one of the first employees at Apple and made many of the design decisions that made the Mac so distinctive when it was first released. He led the team that decided to use a graphical interface and mouse that let people navigate around the computer by pointing and clicking. The 1984 release of the Mac reflected Mr Raskin's belief that good design should make computers easy to use. Mr Raskin joined Apple in 1978 as employee number 31, initially to lead the company's publications department. However, in 1979 he was put in charge of a small team to design a computer that lived up to his idea of a machine that was cheap, aimed at consumers rather than computer professionals and was very easy to use. The result was the 1984 Macintosh that did away with the then common text-based interface in favour of one based around graphics that resembled a virtual desktop and used folders and documents. Users navigated around the machine using a mouse and by pointing, clicking and dragging. Although now in common use in almost all computers, these methods were pioneering when first used in the Macintosh. The GUI was developed by Xerox PARC, and used in its Star machine. But the acceptance of the interface did not truly begin until the concept was developed for use by Apple in its pioneering Lisa computer. ""His role on the Macintosh was the initiator of the project, so it wouldn't be here if it weren't for him,"" said Andy Hertzfeld, an early Macintosh team member. Although Mr Raskin drove the team that created the Macintosh he did not stay at Apple to see it released. In 1981 he was removed from the project following a dispute with Apple's mercurial boss Steve Jobs. In 1982, Mr Raskin left Apple entirely. The Macintosh was reputedly named after Mr Raskin's favourite apple, though the name was changed slightly following a trademark dispute with another company. After leaving Apple, Mr Raskin founded another company called Information Appliance and continued to work on better ways to interface with computers. He was also an accomplished musician, played three instruments and conducted San Francisco's Chamber Opera Society. Mr Raskin was diagnosed in December 2004 with pancreatic cancer and died on 26 February at his home in California.",human,plain_human,RAID,human,,news,25973388-beeb-4f0b-b1e9-e1573361cf36,train,"{""source_id"": ""25973388-beeb-4f0b-b1e9-e1573361cf36"", ""adv_source_id"": ""25973388-beeb-4f0b-b1e9-e1573361cf36"", ""raid_attack_raw"": ""none"", ""raid_model_raw"": ""human""}"
e77a9e7c-05c8-418d-8c5c-a8afa5728b2e,"By 2025, 40% of the UK's population will still be without internet access at home, says a study. Around 23 million Britons will miss out on a wide range of essential services such as education and medical information, predicts the report by telecoms giant BT. It compares to 27 million, or 50%, of the UK, who are not currently online. The idea that the digital divide will evaporate with time is ""wishful thinking"", the report concludes. The study calls on the government and telecoms industry to come up with new ways to lure those that have been bypassed by the digital revolution. Although the percentage of Britons without home access will have fallen slightly, those that remain digital refuseniks will miss out on more, the report suggests. As more and more everyday tasks move online and offline services become less comprehensive, the divide will become more obvious and more burdensome for those that have not got net access, it predicts. The gap between ""have-nets"" and ""have-nots"" has been much talked about, but predictions about how such a divide will affect future generations has been less discussed. BT set out to predict future patterns based on current information and taking account of the way technology is changing. Optimists who predict that convergence and the emergence of more user-friendly technology will bridge the digital divide could be way off mark, the report suggests. ""Internet access on other devices tends to be something taken up by those who already have it,"" said Adrian Hosford, director of corporate responsibility at BT. Costs of internet access have fallen dramatically and coverage in remote areas have vastly improved over the last year but the real barrier remains psychological. ""There is a hard rump of have-nots who are not engaging with the net. They don't have the motivation or skills or perceive the benefits,"" said Mr Hosford. As now, the most disadvantaged groups are likely to remain among low income families, the older generation and the disabled. Those on low incomes will account for a quarter of the digital have-nots, the disabled will make up 16% and the elderly nearly a third by 2025, the report forecasts. Organisations such as BT have a responsibility to help tackle the problem, said Mr Hosford. The telco has seen positive results with its Everybody Online project which offers internet access to people in eight deprived communities around Britain. In one area of Cornwall with high levels of unemployment, online training helped people rewrite CVs and learn skills to get new jobs, explained Mr Hosford. Such grassroot activity addressing the specific needs of individual communities is essential is the problem of the digital divide is to be overcome, he said. ""If we don't address this problem now, it will get a lot worse and people will find it more difficult to find jobs, education opportunities will be limited and they'll simply not be able to keep up with society,"" he said. The Alliance for Digital Inclusion, an independent body with members drawn from government, industry and the voluntary sector has recently been set up to tackle some of the issues faced by the digital refuseniks.",human,plain_human,RAID,human,,news,e77a9e7c-05c8-418d-8c5c-a8afa5728b2e,train,"{""source_id"": ""e77a9e7c-05c8-418d-8c5c-a8afa5728b2e"", ""adv_source_id"": ""e77a9e7c-05c8-418d-8c5c-a8afa5728b2e"", ""raid_attack_raw"": ""none"", ""raid_model_raw"": ""human""}"
f9f0073b-f0fb-4b8f-911c-c0612bf746ad,"The U(1) gauge theory on a space with Lie type noncommutativity is constructed. The construction is based on the group of translation in Fourier space, which in contrast to space itself is commutative. In analogy with lattice gauge theory, the object playing the role of flux of field strength per plaquette, as well as the action, are constructed. It is observed that the theory, in comparison with ordinary U(1) gauge theory, has an extra gauge field component. This phenomena is reminiscent of similar ones in formulation of SU(N) gauge theory in space with canonical noncommutativity, and also appearance of gauge field component in discrete direction of Connes' construction of the Standard Model.",human,plain_human,RAID,human,,abstracts,f9f0073b-f0fb-4b8f-911c-c0612bf746ad,train,"{""source_id"": ""f9f0073b-f0fb-4b8f-911c-c0612bf746ad"", ""adv_source_id"": ""f9f0073b-f0fb-4b8f-911c-c0612bf746ad"", ""raid_attack_raw"": ""none"", ""raid_model_raw"": ""human""}"
7a29782f-3ef2-430a-b489-179a9062e3ae,"The movie, ""Se7en"", starring Brad Pitt, Morgan Freeman, and Gwyneth Paltrow, is by far one of the most inventive, well-written, and cerebral films in recent history. The film, blending a well put together combination of dark visual style, intense plot development, and polished acting, remains tight and focused throughout, from beginning to end, never straying outwards into unimportant issues, or resorting to typical Hollywood clichés. Se7en is uniquely on its own for suspense dramas as it both fuels the need of the audience to be drawn in and entertained by the events unfolding, and remain uncompromising and shocking, thus satisfying the initial vision of the director, David Fincher.<br/><br/>The story surrounds the hunt for a serial killer, who, inspired by Dante Alighieri's seven deadly sins from ""The Divine Comedy"", sets out to, ""preach"" about man's impurity, and does so by targeting victims, then torturing them by pitting their own underlining sins against them. Se7en seemingly starts out as a typical cat and mouse detective story, however, it quickly develops into of a sort of modern-myth, with good and evil taking centre stage. The story is original on all counts, and thrilling on all levels. The most important aspect of Se7en, however, is that it keeps the audience numerous steps behind its story, as oppose to other thrillers, which become predictable and bland by the end. By keeping the audience in the dark, the film remains fresh and original as it progresses. Se7en even dramatically turns the tide at one point, just as the audience is finally getting comfortable and asserted into the gloomy atmosphere, thus creating as much as fear and uncertainty in the audience as it is with the characters involved. By the film's conclusion, the audience is as much apart of the film as the characters themselves, and arrive at Se7en's surprise ending without a single clue of it, prior to it occurring. Se7en's poetic ending(which will not be given away) says a lot for the people behind the movie, showing they are not afraid of going against the grain. A rarity with films so nowadays.<br/><br/>Directed brilliantly by David Fincher, and skillfully written by Andrew Kevin Walker, Se7en is well crafted and ingeniously clever, making it one of the greatest films of the 90's. While Se7en may not have garnered critical acclaim as such films as Silence of the Lambs, Se7en is, undoubtedly, as influential as any film to date.<br/><br/>Score 10/10",human,plain_human,RAID,human,,reviews,7a29782f-3ef2-430a-b489-179a9062e3ae,train,"{""source_id"": ""7a29782f-3ef2-430a-b489-179a9062e3ae"", ""adv_source_id"": ""7a29782f-3ef2-430a-b489-179a9062e3ae"", ""raid_attack_raw"": ""none"", ""raid_model_raw"": ""human""}"
78705d81-e167-4d87-a300-9145f39abea2,"Accurate image segmentation of the liver is a challenging problem owing to its large shape variability and unclear boundaries. Although the applications of fully convolutional neural networks (CNNs) have shown groundbreaking results, limited studies have focused on the performance of generalization. In this study, we introduce a CNN for liver segmentation on abdominal computed tomography (CT) images that shows high generalization performance and accuracy. To improve the generalization performance, we initially propose an auto-context algorithm in a single CNN. The proposed auto-context neural network exploits an effective high-level residual estimation to obtain the shape prior. Identical dual paths are effectively trained to represent mutual complementary features for an accurate posterior analysis of a liver. Further, we extend our network by employing a self-supervised contour scheme. We trained sparse contour features by penalizing the ground-truth contour to focus more contour attentions on the failures. The experimental results show that the proposed network results in better accuracy when compared to the state-of-the-art networks by reducing 10.31% of the Hausdorff distance. We used 180 abdominal CT images for training and validation. Two-fold cross-validation is presented for a comparison with the state-of-the-art neural networks. Novel multiple N-fold cross-validations are conducted to verify the performance of generalization. The proposed network showed the best generalization performance among the networks. Additionally, we present a series of ablation experiments that comprehensively support the importance of the underlying concepts.",human,plain_human,RAID,human,,abstracts,78705d81-e167-4d87-a300-9145f39abea2,train,"{""source_id"": ""78705d81-e167-4d87-a300-9145f39abea2"", ""adv_source_id"": ""78705d81-e167-4d87-a300-9145f39abea2"", ""raid_attack_raw"": ""none"", ""raid_model_raw"": ""human""}"
13e9fe6d-84b7-456e-8824-9c8cd2224877,"Alice Garcia Reyes (born October 14, 1942) is a Filipina dancer, choreographer, teacher, director and producer. The founder (together with Eddie Elejar) of Ballet Philippines, she received since June 20, 2014 from the Philippine President Benigno Aquino III the highest award in the Arts, National Artist of the Philippines. She was chiefly responsible in popularizing contemporary dance with the Alice Reyes Dance Company which staged the first modern dance concert at the Cultural Center of the Philippines Main Theater in February 1970. It was this company that later became Ballet Philippines. She is best known for ""Bungkos Suite"", ""Carmen"", ""Carmina Burana"", ""Romeo and Juliet"", ""Rama Hari"", ""Cinderella"", ""Amada"", ""Itim-Asu"", and ""Tales of the Manuvu""—all nuanced with Filipino culture, gesture and grace. Early life and education Reyes was born on October 14, 1942. At a very young age, Reyes took up lessons in classical ballet under Rosalia Merino while studying at Maryknoll College where she completed a Bachelor of Arts degree in History and Foreign Services.",human,plain_human,RAID,human,,wiki,13e9fe6d-84b7-456e-8824-9c8cd2224877,train,"{""source_id"": ""13e9fe6d-84b7-456e-8824-9c8cd2224877"", ""adv_source_id"": ""13e9fe6d-84b7-456e-8824-9c8cd2224877"", ""raid_attack_raw"": ""none"", ""raid_model_raw"": ""human""}"
c433c5f6-cf9f-49c6-9b0f-7fc85852d4da,"A poem moves forward, Like the passages and percussions of trains in progress A pattern of recurrence, a hammer of repetetiveoccurrence a slow less and less heard low thunder under all passengers Steel sounds tripping and tripled and Grinding, revolving, gripping, turning, and returning as the flung carpet of the wide countryside spreads out on each side in billows And in isolation, rolled out, white house, red barn, squat silo, Pasture, hill, meadow and woodland pasture And the striped poles step fast past the train windows Second after second takes snapshots, clicking, Into the dangled boxes of glinting windows Snapshots and selections, rejections, at angles, of shadows A small town: a shop's sign - GARAGE, and then white gates Where waiting cars wait with the unrest of trembling Breathing hard and idling, until the slow~descent Of the red cones of sunset: a dead march: a slow tread and heavy Of the slowed horses of Apollo - Until the slowed horses of Apollo go over the horizon And all things are parked, slowly or willingly, into the customary or at random places.",human,plain_human,RAID,human,,poetry,c433c5f6-cf9f-49c6-9b0f-7fc85852d4da,train,"{""source_id"": ""c433c5f6-cf9f-49c6-9b0f-7fc85852d4da"", ""adv_source_id"": ""c433c5f6-cf9f-49c6-9b0f-7fc85852d4da"", ""raid_attack_raw"": ""none"", ""raid_model_raw"": ""human""}"
6d8dbd8e-d23b-4dc8-b193-7af2fe600293,"We pursue the analysis of nesting statistics in the $O(n)$ loop model on random maps, initiated for maps with the topology of disks and cylinders in math-ph/1605.02239, here for arbitrary topologies. For this purpose we rely on the topological recursion results of math-ph/0910.5896 and math-ph/1303.5808 for the enumeration of maps in the $O(n)$ model. We characterize the generating series of maps of genus $g$ with $k'$ marked points and $k$ boundaries and realizing a fixed nesting graph. These generating series are amenable to explicit computations in the loop model with bending energy on triangulations, and we characterize their behavior at criticality in the dense and in the dilute phase.",human,plain_human,RAID,human,,abstracts,6d8dbd8e-d23b-4dc8-b193-7af2fe600293,train,"{""source_id"": ""6d8dbd8e-d23b-4dc8-b193-7af2fe600293"", ""adv_source_id"": ""6d8dbd8e-d23b-4dc8-b193-7af2fe600293"", ""raid_attack_raw"": ""none"", ""raid_model_raw"": ""human""}"
4197dc89-c286-42f6-a9bf-0c0ab065f0bc,I’m failing almost all of my classes. I thought I was doing fine and found out after midterm grades came in that I am not. Most of it is because I didn’t know I was supposed to do assignments because the online system is confusing. Or because I haven’t been attending zoom classes because of internet problems. I get almost every question on math lab wrong because I get the answer right but the system says u typed it in wrong. I don’t even know what to do. I’ve already missed 2 tests. I withdrew from my film arts class and I have 3 hours to decide if I should withdraw from any other classes. I’m a freshman. How bad is it to withdraw from classes like math? I really need to know if it’s better to withdraw or take my chances improving my grade. Please help,human,plain_human,RAID,human,,reddit,4197dc89-c286-42f6-a9bf-0c0ab065f0bc,train,"{""source_id"": ""4197dc89-c286-42f6-a9bf-0c0ab065f0bc"", ""adv_source_id"": ""4197dc89-c286-42f6-a9bf-0c0ab065f0bc"", ""raid_attack_raw"": ""none"", ""raid_model_raw"": ""human""}"
c2d3c7d1-78da-4b52-9989-8f10519efdfa,"The story traces the life of David Copperfield from childhood to maturity. David was born in Blunderston near Great Yarmouth, Norfolk, England, in 1820, six months after the death of his father. Seven years later, his mother re-marries Edward Murdstone. David is given good reason to dislike his stepfather and has similar feelings for Murdstone's sister Jane, who moves into the house soon afterwards. Murdstone thrashes David for falling behind in his studies. Following one of these thrashings, David bites him and soon afterward is sent away to a boarding school, Salem House, with a ruthless headmaster, Mr. Creakle. There he befriends James Steerforth and Tommy Traddles. David returns home for the holidays to learn that his mother has given birth to a baby boy. Shortly after David returns to Salem House, his mother and her baby die and David returns home immediately. Murdstone sends him to work in a factory in London, of which Murdstone is a joint owner. Copperfield's landlord, Wilkins Micawber, is sent to debtor's prison (the King's Bench Prison) and remains there for several months before being released and moving to Plymouth. No one remains to care for David in London, so he decides to run away. He walks from London to Dover, where he finds his only relative, his unmarried, eccentric aunt Betsey Trotwood. She agrees to raise him, despite Murdstone's attempt to regain custody of David. David's aunt renames him ""Trotwood Copperfield"" and addresses him as ""Trot"", and it becomes one of several names to which David answers in the course of the novel. As David grows to adulthood, a variety of characters enter, leave, and re-enter his life. These include Peggotty – his mother's faithful former housekeeper – and Peggotty's family, including her orphaned niece ""Little Em'ly"", who moves in with them and charms the young David. David's romantic but self-serving school friend, Steerforth, seduces and dishonours Little Em'ly, precipitating the novel's greatest tragedy, and his landlord's daughter Agnes Wickfield, becomes his confidante. The novel's two most familiar characters are David's sometime mentor, the debt-ridden Micawber, and the devious and fraudulent clerk, Uriah Heep, whose misdeeds are eventually revealed with Micawber's assistance. Micawber is painted sympathetically even as the narrator deplores his financial ineptitude. Micawber, like Dickens' own father, is briefly imprisoned for insolvency. The major characters eventually get some measure of what they deserve, and few narrative threads are left hanging. Dan Peggotty safely transports Emily to a new life in Australia, accompanied by Gummidge and the Micawbers. All eventually find security and happiness in their adopted country. David marries the beautiful but naïve Dora Spenlow, who dies after failing to recover from a miscarriage early in their marriage. David then searches his soul and marries the sensible Agnes, who had always loved him and with whom he finds true happiness. David and Agnes then have three children, including a daughter named after his aunt Betsey Trotwood.",human,plain_human,RAID,human,,books,c2d3c7d1-78da-4b52-9989-8f10519efdfa,train,"{""source_id"": ""c2d3c7d1-78da-4b52-9989-8f10519efdfa"", ""adv_source_id"": ""c2d3c7d1-78da-4b52-9989-8f10519efdfa"", ""raid_attack_raw"": ""none"", ""raid_model_raw"": ""human""}"
e68fce69-dbdc-43a7-a9b6-a799d85dda13,"The perceptual-based grouping process produces a hierarchical and compositional image representation that helps both human and machine vision systems recognize heterogeneous visual concepts. Examples can be found in the classical hierarchical superpixel segmentation or image parsing works. However, the grouping process is largely overlooked in modern CNN-based image segmentation networks due to many challenges, including the inherent incompatibility between the grid-shaped CNN feature map and the irregular-shaped perceptual grouping hierarchy. Overcoming these challenges, we propose a deep grouping model (DGM) that tightly marries the two types of representations and defines a bottom-up and a top-down process for feature exchanging. When evaluating the model on the recent Broden+ dataset for the unified perceptual parsing task, it achieves state-of-the-art results while having a small computational overhead compared to other contextual-based segmentation models. Furthermore, the DGM has better interpretability compared with modern CNN methods.",human,plain_human,RAID,human,,abstracts,e68fce69-dbdc-43a7-a9b6-a799d85dda13,train,"{""source_id"": ""e68fce69-dbdc-43a7-a9b6-a799d85dda13"", ""adv_source_id"": ""e68fce69-dbdc-43a7-a9b6-a799d85dda13"", ""raid_attack_raw"": ""none"", ""raid_model_raw"": ""human""}"
d78b9be4-43b5-4aab-ac9a-a31205a9302e,"A film based on the internet musings of the ""Baghdad Blogger"" has been shown at the Rotterdam Film Festival. The film has been directed by the man who calls himself Salam Pax, the author of the weblog about Iraqi life during and after the war. The movie version comes in the form of a series of shorts made by Pax on a hand-held camera. Baghdad Blogger is among a number of films about Iraq showcased at the Dutch festival, which runs until Sunday. Following the fascination with the writing of Salam Pax - not his real name - he began a regular column in The Guardian newspaper and was given a crash course in documentary film-making. For the film he travelled Iraq to document the changing landscape of the country and the problems it has faced since the invasion, speaking to ordinary Iraqis about their experiences. The festival will also see the screening of Underexposure, one of Iraq's first features to emerge since the toppling of Saddam Hussein. Director Oday Rasheed made the film on discarded 1980s Kodak film taken from the remains for the former Ministry of Culture building. It centres on the lives of families and strangers going about their everyday business as Baghdad is under siege. Rasheed said the title was refers to the isolation felt by Iraqis under Saddam's regime and the difficult time the country is now experiencing. ""Saddam's regime was hell, but now I think the hell has doubled,"" Rasheed said. The festival was also due to screen murdered Dutch film-maker Theo Van Gogh's film about the treatment of woman under Islam, but it was withdrawn due to safety fears. Van Gogh was shot and stabbed in November 2004, following death threats he received about his film Submission.",human,plain_human,RAID,human,,news,d78b9be4-43b5-4aab-ac9a-a31205a9302e,train,"{""source_id"": ""d78b9be4-43b5-4aab-ac9a-a31205a9302e"", ""adv_source_id"": ""d78b9be4-43b5-4aab-ac9a-a31205a9302e"", ""raid_attack_raw"": ""none"", ""raid_model_raw"": ""human""}"
204f7107-b068-4968-9bf4-0f0a3384b707,"The UK has welcomed the decision by India and Pakistan to open a bus link across the ceasefire line dividing the disputed region of Kashmir. Foreign Secretary Jack Straw, touring South East Asian countries, praised the ""spirit of cooperation"" in achieving the breakthrough. Media reports in both countries describe the deal as a major step in the ongoing peace process. Mr Straw said he hoped the agreement would make a difference to Kashmiris. The bus service was one of several announcements made after a meeting of foreign ministers of both countries in Islamabad on Wednesday. Kashmiri politicians on both sides of the Line of Control which divides the region welcomed the move. In a statement, Mr Straw said the bus service between Srinagar and Muzaffarabad ""will be able to reunite families that have been divided for decades"". ""This will make a real difference to the lives of Kashmiris on both sides of the Line of Control,"" he said. ""I warmly applaud the efforts of both India and Pakistan to make this happen. ""This spirit of cooperation will, I hope, lead to many more measures that will benefit all in the region."" On Thursday Mr Straw was in India visiting Sikhism's holiest shrine, the Golden Temple in Amritsar where he tried his hand at making Indian bread or roti. He is due to take part in talks with the Indian government on Friday. A second bus service linking the Pakistani city of Lahore with Amritsar in India was also announced as well as a rail link between Rajasthan state and Pakistan's Sindh province. Both sides agreed to begin talks on reducing the risk of nuclear accidents and also said they planned to reopen their respective consulates in Karachi and Mumbai (Bombay). The mountainous region of Kashmir has been a flashpoint between the two nuclear powers for more than 50 years.",human,plain_human,RAID,human,,news,204f7107-b068-4968-9bf4-0f0a3384b707,train,"{""source_id"": ""204f7107-b068-4968-9bf4-0f0a3384b707"", ""adv_source_id"": ""204f7107-b068-4968-9bf4-0f0a3384b707"", ""raid_attack_raw"": ""none"", ""raid_model_raw"": ""human""}"
