id,text,label,variant,source_dataset,generator_model,attack_type,domain,group_id,split,metadata
4f6b7e6f-2114-4f83-a109-7e74f5945aa2,"The play is set in the 17th century in Europe during the Thirty Years' War. The Recruiting Officer and Sergeant are introduced, both complaining about the difficulty of recruiting soldiers to the war. A canteen woman named Anna Fierling (Mother Courage) enters pulling a cart that she uses to trade with soldiers and make profits from the war. She has three children, Eilif, Kattrin, and Swiss Cheese. The sergeant negotiates a deal with Mother Courage while Eilif is led off by the recruiting officer. One of her children is now gone. Two years from then, Mother Courage argues with a Protestant General's cook over a capon, or chicken. At the same time, Eilif is congratulated by the General for killing peasants and slaughtering their cattle. Eilif and his mother sing ""The Fishwife and the Soldier"". Mother Courage scolds her son for taking risks that could have got him killed and slaps him across the face. Three years later, Swiss Cheese works as an army paymaster. The camp prostitute, Yvette Pottier, sings ""The Fraternization Song"". Mother Courage uses this song to warn Kattrin about involving herself with soldiers. Before the Catholic troops arrive, the Cook and Chaplain bring a message from Eilif. Swiss Cheese hides the regiment's paybox from invading soilders. Mother Courage & co. hurriedly switch their insignia from Protestant to Catholic. Swiss Cheese is captured by the Catholics while attempting to return the paybox to his General. Mother Courage deals her cart to get money to try and barter with the soldiers to free her son. She takes too long trying negotiate small amount of money for herself, the Chaplin, and Kattrin to live from and Swiss Cheese is shot dead with 11 bullets. To acknowledge the body could be fatal, so Mother Courage does not acknowledge it and it is thrown into a pit. Later, Mother Courage waits outside the General's tent in order to register a complaint and sings the ""Song of Great Capitulation"" to a young soldier waiting for the General as well. The soldier is angry that he has not been paid and also wishes to complain. The song persuades the soldier that complaining would be unwise, and Mother Courage (reaching the same conclusion) decides she also does not want to complain. When Catholic General Tilly's funeral approaches, Mother Courage discusses with the Chaplain about whether the war will continue. The Chaplain then suggests to Mother Courage that she marry him, but she rejects his proposal. Mother Courage curses the war because she finds Kattrin disfigured after being raped by the clerk while collecting more merchandise. At some point about here Mother Courage is again following the Protestant army. Two peasants wake Mother Courage up and try to sell merchandise to her while they find out that peace has broken out. The Cook appears and creates an argument between Mother Courage and the Chaplain. Mother Courage departs for the town while Eilif enters, dragged in by soldiers. Eilif is executed for killing peasants but his mother never finds out. When the war begins again, the Cook and Mother Courage start their own business. The seventeenth year of the war marks a point where there is no food and no supplies. The Cook inherits an inn in Utrecht and suggests to Mother Courage that she operate it with him, but he refuses to harbour Kattrin. It is a very small inn. Mother Courage will not leave her daughter and they part ways with the Cook. Mother Courage and Kattrin pull the wagon by themselves. The Catholic army attacks the small Protestant town of Halle while Mother Courage is away from town, trading. Kattrin is woken up by a search party that is taking peasants as guides. Kattrin fetches a drum from the cart, climbs onto the roof, and beats it in an attempt to awake the townspeople. Though the soldiers shoot Kattrin, she succeeds in waking up the town. Early in the morning, Mother Courage sings to her daughter's corpse, has the peasants bury her and hitches herself to the cart. The cart rolls lighter now because there are no more children and very little merchandise left.",human,plain_human,RAID,human,,books,4f6b7e6f-2114-4f83-a109-7e74f5945aa2,train,"{""source_id"": ""4f6b7e6f-2114-4f83-a109-7e74f5945aa2"", ""adv_source_id"": ""4f6b7e6f-2114-4f83-a109-7e74f5945aa2"", ""raid_attack_raw"": ""none"", ""raid_model_raw"": ""human""}"
eaf4d80a-da76-46e3-81b6-121908133458,"We present a systematic methodology to develop high order accurate numerical approaches for linear advection problems. These methods are based on evolving parts of the jet of the solution in time, and are thus called jet schemes. Through the tracking of characteristics and the use of suitable Hermite interpolations, high order is achieved in an optimally local fashion, i.e. the update for the data at any grid point uses information from a single grid cell only. We show that jet schemes can be interpreted as advect-and-project processes in function spaces, where the projection step minimizes a stability functional. Furthermore, this function space framework makes it possible to systematically inherit update rules for the higher derivatives from the ODE solver for the characteristics. Jet schemes of orders up to five are applied in numerical benchmark tests, and systematically compared with classical WENO finite difference schemes. It is observed that jet schemes tend to possess a higher accuracy than WENO schemes of the same order.",human,plain_human,RAID,human,,abstracts,eaf4d80a-da76-46e3-81b6-121908133458,train,"{""source_id"": ""eaf4d80a-da76-46e3-81b6-121908133458"", ""adv_source_id"": ""eaf4d80a-da76-46e3-81b6-121908133458"", ""raid_attack_raw"": ""none"", ""raid_model_raw"": ""human""}"
b2fcea6b-22f5-48f0-ab07-1c00fd48b8f0,"Reactive Turing machines extend classical Turing machines with a facility to model observable interactive behaviour. We call a behaviour (finitely) executable if, and only if, it is equivalent to the behaviour of a (finite) reactive Turing machine. In this paper, we study the relationship between executable behaviour and behaviour that can be specified in the $\pi$-calculus. We establish that every finitely executable behaviour can be specified in the $\pi$-calculus up to divergence-preserving branching bisimilarity. The converse, however, is not true due to (intended) limitations of the model of reactive Turing machines. That is, the $\pi$-calculus allows the specification of behaviour that is not finitely executable up to divergence-preserving branching bisimilarity. We shall prove, however, that if the finiteness requirement on reactive Turing machines and the associated notion of executability is relaxed to orbit-finiteness, then the $\pi$-calculus is executable up to (divergence-insensitive) branching bisimilarity.",human,plain_human,RAID,human,,abstracts,b2fcea6b-22f5-48f0-ab07-1c00fd48b8f0,train,"{""source_id"": ""b2fcea6b-22f5-48f0-ab07-1c00fd48b8f0"", ""adv_source_id"": ""b2fcea6b-22f5-48f0-ab07-1c00fd48b8f0"", ""raid_attack_raw"": ""none"", ""raid_model_raw"": ""human""}"
bcf4d996-ce17-4e92-87d1-5b568e03272f,"We should feel free to get the most damage. This update just punishes people who spent $ on ghultures, pack gear, and pets. It’s so easy for fire/storm to get high damage but a lot just want the highest. Who ever complained about damage in PvE? The mobs? We already got a spell audit initially nerfing some schools and their damage, along with the critical nerf, and now they’re putting a cap on damage at the worst times. It would’ve worked back then, but now they introduce heat that give set bonuses. These set bonuses will have no affect for fires / storms and even myths since they can get high damage quite easily. What we’re going to end up is every school having relatively the same damage since 165-200% is not a big increase with damage at all now. It may be stupid but a lot of people spent a lot of $ and time to get that final ~10% increase of damage whether it be getting a quint be quad damage pet, a ghulture, and/or a gear set. Now that final increase will have such an insignificant impact on damage, even if you blade stack.",human,plain_human,RAID,human,,reddit,bcf4d996-ce17-4e92-87d1-5b568e03272f,train,"{""source_id"": ""bcf4d996-ce17-4e92-87d1-5b568e03272f"", ""adv_source_id"": ""bcf4d996-ce17-4e92-87d1-5b568e03272f"", ""raid_attack_raw"": ""none"", ""raid_model_raw"": ""human""}"
592a08de-7d7f-4e45-8167-418a67f3f7e9,"In a randomized study, leveraging covariates related to the outcome (e.g. disease status) may produce less variable estimates of the effect of exposure. For contagion processes operating on a contact network, transmission can only occur through ties that connect affected and unaffected individuals; the outcome of such a process is known to depend intimately on the structure of the network. In this paper, we investigate the use of contact network features as efficiency covariates in exposure effect estimation. Using augmented generalized estimating equations (GEE), we estimate how gains in efficiency depend on the network structure and spread of the contagious agent or behavior. We apply this approach to simulated randomized trials using a stochastic compartmental contagion model on a collection of model-based contact networks and compare the bias, power, and variance of the estimated exposure effects using an assortment of network covariate adjustment strategies. We also demonstrate the use of network-augmented GEEs on a clustered randomized trial evaluating the effects of wastewater monitoring on COVID-19 cases in residential buildings at the the University of California San Diego.",human,plain_human,RAID,human,,abstracts,592a08de-7d7f-4e45-8167-418a67f3f7e9,train,"{""source_id"": ""592a08de-7d7f-4e45-8167-418a67f3f7e9"", ""adv_source_id"": ""592a08de-7d7f-4e45-8167-418a67f3f7e9"", ""raid_attack_raw"": ""none"", ""raid_model_raw"": ""human""}"
a03943ed-c4af-4fe1-9117-c7cb3cfe116b,"3 cups original Bisquick baking mix 1 lb bulk pork sausage 4 cups shredded cheddar cheese (16 ounces) 12 cup grated parmesan cheese 12 cup milk 12 teaspoon dried rosemary leaves, crushed 1 12 teaspoons chopped fresh parsley or 12 teaspoon parsley flakes barbecue sauce or chili sauce, if desired Heat oven to 350 degrees F. Lightly grease bottom and sides of jelly roll pan, 15 1/2x10 1/2x2x1 inch. Stir together all ingredients, using hands or spoon. Shape mixture into 1-inch balls. Place in pan. Bake 20 to 25 minutes or until brown. Immediately remove from pan. Serve warm with sauce for dipping. High Altitude (3500-6500 ft) Heat oven to 375 degrees F. Decrease Bisquick to 2 1/2 cups; stir in 1/2 cup Gold Medal all-purpose flour. Bake 25 to 30 minutes. Make the Most of This Recipe. Do-Ahead Tip. Want to make these savory cheese balls ahead? Your options are many! You can:. Cover and refrigerate unbaked balls up to 24 hours. Bake as directed. Cover and freeze unbaked balls up to 1 month. Heat oven to 350 degrees F. Place frozen balls on ungreased cookie sheet. Bake 25 to 30 minutes or until brown. Bake as directed; cover and freeze up to 1 month. Heat oven to 350 degrees F. Place frozen balls on ungreased cookie sheet. Bake 10 to 12 minutes or until heated through. Bake as directed; cover and freeze up to 1 month. Place 6 frozen balls on microwavable plate. Loosely cover with waxed paper. Microwave on High 45 seconds to 1 minute or until heated through. Success. It's true. You don't need to cook the sausage before using it when making this recipe.",human,plain_human,RAID,human,,recipes,a03943ed-c4af-4fe1-9117-c7cb3cfe116b,train,"{""source_id"": ""a03943ed-c4af-4fe1-9117-c7cb3cfe116b"", ""adv_source_id"": ""a03943ed-c4af-4fe1-9117-c7cb3cfe116b"", ""raid_attack_raw"": ""none"", ""raid_model_raw"": ""human""}"
f0751e9d-2425-439e-8e91-b3546191518c,"Superpixel segmentation is becoming ubiquitous in computer vision. In practice, an object can either be represented by a number of segments in finer levels of detail or included in a surrounding region at coarser levels of detail, and thus a superpixel segmentation hierarchy is useful for applications that require different levels of image segmentation detail depending on the particular image objects segmented. Unfortunately, there is no method that can generate all scales of superpixels accurately in real-time. As a result, a simple yet effective algorithm named Super Hierarchy (SH) is proposed in this paper. It is as accurate as the state-of-the-art but 1-2 orders of magnitude faster. The proposed method can be directly integrated with recent efficient edge detectors like the structured forest edges to significantly outperforms the state-of-the-art in terms of segmentation accuracy. Quantitative and qualitative evaluation on a number of computer vision applications was conducted, demonstrating that the proposed method is the top performer.",human,plain_human,RAID,human,,abstracts,f0751e9d-2425-439e-8e91-b3546191518c,train,"{""source_id"": ""f0751e9d-2425-439e-8e91-b3546191518c"", ""adv_source_id"": ""f0751e9d-2425-439e-8e91-b3546191518c"", ""raid_attack_raw"": ""none"", ""raid_model_raw"": ""human""}"
758e4649-48e2-4856-bb96-bfd8b4a8f299,"Scott Pilgrim vs. the World is probably as close as we'll come to having an experimental film released in theaters nationwide. This is one of the most innovative, original movies to come out in years. It's unlike anything I'd seen before. And yes, it is good, very good. I could not stop laughing the whole time.<br/><br/>Onto the plot. Scott is something of a loser. He's socially awkward. He shares a mattress in a bunker-like apartment in Toronto with a sarcastic gossip king. He's in a band called the Sex Bob-Ombs, but they're really not that great. He also has a clinging, hyperactive girlfriend, ""Knives"" who's only 17- kind of a big deal when he's 22. All this changes when he dreams of a purple haired girl on roller blades. The very next day he finds out that she's real; that her name is Ramona flowers and she's the cool new girl in town. His first attempt to hook up fails miserably. His second attempt, although even more lamed brained, actually works, and they're soon an item. But now comes the bad news; to win her love, Scott must defeat her seven evil ex's. He also has an evil ex of his own. Plus, there's the matter of breaking up with Knives, and the battle of the bands is coming up!<br/><br/>That's the setup, what follows is a hilarious romantic comedy punctuated by a series of completely over-the-top video game style fight scenes. Stylistically, I'd have to call them a cross between Sin City, Street Fighter and Viewtiful Joe. Each of the ex's has their own unique fighting style and their own super powers, such as vegan-powered telekinesis or summoning an army of stunt doubles. Often you hear martial arts movies criticized because the action is obviously computer aided. Here, that's the whole point.<br/><br/>The movie's humor comes not only from the sheer ridiculousness of the situations, but also from the characters' reactions to them. After one of the ex's has flown in through a brick wall and battled Scott in the middle of a concert, everyone is just kind of weirded out. They don't act like nothing has happened, which would make it hard for the audience to suspend their disbelief, nor do they run screaming for the police, which would only complicate matters.<br/><br/>Comedic effect is also generated through the use of deadpan dialog. For instance, when Knives confesses that she's never kissed a boy before, Scott replies, with a straight face ""It's okay, neither have I."" Or the band's self-introduction, ""We're the Sex Bob-Ombs and we're here to make you all sad and depressed and stuff.<br/><br/>The movie also pokes gentle fun at hipster subculture with the way that Ramona has thirty plus flavors of tea, or how Scott's roommate is always texting. There are also quirky touches like one girl who can bleep herself out, much to Scott's amazement, and a scene when the intro from Seinfeld plays after the characters enter the apartment, and canned laughter follows every line.<br/><br/>The editing and structure are highly non-traditional, with heavy use of dreams, daydreams, montages, animated flashbacks and asides, and chapter titles introducing segments. The visuals are impressive and very imaginative, such as the way that flashes of color accompany the playing of any musical instrument, allowing you to see the sound. Speaking of which, the sound is another high point, not only the energetic, rock fueled sound track, but also the sound effects taken from classic games like Mario and Zelda.<br/><br/>Scott Pilgrim vs. the World succeeds in telling an offbeat story, providing interesting characters, and in producing lots of laughs. Other than a couple of too-obvious puns, I honestly can't think of anything wrong with this movie. I would highly recommend it to anyone in their teens or twenties. Four stars.",human,plain_human,RAID,human,,reviews,758e4649-48e2-4856-bb96-bfd8b4a8f299,train,"{""source_id"": ""758e4649-48e2-4856-bb96-bfd8b4a8f299"", ""adv_source_id"": ""758e4649-48e2-4856-bb96-bfd8b4a8f299"", ""raid_attack_raw"": ""none"", ""raid_model_raw"": ""human""}"
edb42a1a-8686-4c79-9a43-e8836a9314f6,"Deundra Hundon ( Fenley) is an American doula, teacher, activist and birth worker in San Francisco. Life and career Deundra was born and raised in San Francisco, California. From age thirteen she wanted to be a doula but wasn't supported in her adolescent years into adulthood. Instead, pursuing a career in education and completing a bachelor's degree in Business Administration. She worked in childcare and education as a teacher, program director at San Francisco's University High School site, family support coordinator and college advisor for over 25 years. Completing her BA opened the opportunity for her to earn grants with Wells Fargo for a formal martial arts business located on on the Third Street corridor. After attending Oprah’s, “The Life You Want Weekend”, her passion for birth work was reignited. She immediately began researching Doula training programs and sign up for Cornerstone Doula Trainings, which was owned and operated by a mother-daughter team. Both of Deundra's paternal grandparents resided in the great state of Texas. Specifically, her dad was born in raised in Nacogdoches, TX (a population of just over 32,000). Her great aunt was the midwife of Nacogdoches and was responsible for the birth of babies from families, no matter their ethnicity. As a result, local community members and her family provided postpartum care throughout the entire town. After the great migration, their family bought homes in the Bayview and at one time operated a small market in the neighborhood.",human,plain_human,RAID,human,,wiki,edb42a1a-8686-4c79-9a43-e8836a9314f6,train,"{""source_id"": ""edb42a1a-8686-4c79-9a43-e8836a9314f6"", ""adv_source_id"": ""edb42a1a-8686-4c79-9a43-e8836a9314f6"", ""raid_attack_raw"": ""none"", ""raid_model_raw"": ""human""}"
41932e72-f07d-4770-a0e4-0d4e9d1b0156,"Hayao Miyazaki has no equal when it comes to using hand-drawn animation as a form of storytelling, yet often he is being compared to Walt Disney. That is just so unfair, because it becomes apparent by watching Miyazaki's films that he is the superior artist. He really has a gift of thrilling both grownups and children, and Laputa is indeed one awesome ride.<br/><br/>But where can I begin to describe a movie so magical and breathtaking! Miyazaki's works have never cease to amaze me. Laputa is an adventure of a grand scale and I wonder how a film can be so packed with details and imagination. Ask yourself this question: if you are a kid dreaming of an adventure so grand in scope and so magical, what would it be like? The answer would be to strap yourself in some seat and watch Laputa, because it's truly a childhood fantasy come true. Every minute of the movie is rich and engrossing ... from the train chase to the amazing air-flying sequences... and to the wonderous sight of the floating castle itself. Not to mention the excellent score by Joe Hisaishi! Everything you ever possibly want from an adventure movie is here.",human,plain_human,RAID,human,,reviews,41932e72-f07d-4770-a0e4-0d4e9d1b0156,train,"{""source_id"": ""41932e72-f07d-4770-a0e4-0d4e9d1b0156"", ""adv_source_id"": ""41932e72-f07d-4770-a0e4-0d4e9d1b0156"", ""raid_attack_raw"": ""none"", ""raid_model_raw"": ""human""}"
5f9342be-f0e8-4235-a413-eccb5735d51a,"4 tablespoons kosher salt 2 tablespoons paprika 2 tablespoons chili powder 1 tablespoon toasted and ground cumin 1 tablespoon toasted and ground coriander 1/2 teaspoon ground cinnamon 1 teaspoon grated lime zest 1 tablespoon crumbled achiote 3 racks baby back pork ribs (about 5 pounds) 1 quart chicken stock 64 ounces beer 3 bay leaves 1/4 cup extra-virgin olive oil 4 poblano chiles, seeded and chopped 3 medium onions, roughly cut 2 tablespoons minced garlic 3 carrots, roughly chopped 2 sliced and seeded jalapeno chile peppers 2 (20-ounce) cans Roma tomatoes 3/4 cups molasses 1 cup honey 1 (2-ounce) can chipotle chiles in adobo sauce 1 orange, peeled with pith removed Salt and freshly ground black pepper 3/4 cup red wine vinegar 3/4 cup lime juice Spice Rub Mix: Mix together all ingredients. Ribs: Preheat gas grill on low for 1/2 hour. If using charcoal, let the coals burn to embers, also about 1/2 hour after lighting. Cut the rib racks in half horizontally along the bone. Season the ribs with a 1/2 of the spice rub mix. In a large roasting pan, add chicken stock, beer, and the bay leaves. Lower the ribs into the liquid. Bring up to a simmer and poach the ribs for 15 minutes. Take the ribs out of the liquid and season them with the other 1/2 of the spice rub on both sides. While re-spicing the ribs, bring the liquid up to a boil over low heat to reduce. Take the ribs outside to the grill. The coals should be at the ember stage. Gas grills stay on low. Place ribs on the grill and cover to smoke for 2 hours. While ribs are cooking, the sauce can be finished. Add the olive oil to a large, preheated saute pan. Add the poblanos and onions, and saute for 5 or 6 minutes, until carmelized. Add the garlic, carrots, and jalapenos and saute another 3 minutes. Add the Roma tomatoes and let it simmer 20 minutes. Add the molasses, honey, and chipotle with adobo sauce. Add the orange, then salt and pepper. When the initial braising liquid has reduced by half, add this to the sauce mixture. Let everything simmer for 20 minutes, or pop in a preheated 350 degrees F oven for 20 minutes. Blend sauce mixture in a blender or food processor until smooth. Stir in red wine vinegar and lime juice. Bring sauce to grill and brush on ribs for the last half hour of grilling.",human,plain_human,RAID,human,,recipes,5f9342be-f0e8-4235-a413-eccb5735d51a,train,"{""source_id"": ""5f9342be-f0e8-4235-a413-eccb5735d51a"", ""adv_source_id"": ""5f9342be-f0e8-4235-a413-eccb5735d51a"", ""raid_attack_raw"": ""none"", ""raid_model_raw"": ""human""}"
ea7ceefc-e300-41b6-ab29-4606855c03b2,"I don’t know how exactly to explain this, but when I was little, I used to get these breathing “bursts.” What I mean by that is there were times when I would breath in as if to take a deep breath, but instead of a normal deep breath it felt like I was breathing in happiness. Bare with me I know this sounds crazy. This was a feeling of all over calming, clean, comforting, burst of I don’t know what to call it. It would happen at different times like while was playing or other random times. It would happen maybe a couple of times a week from what I remember. All I know is that it happened regularly throughout my childhood but stopped sometime before my teen years. I’ve never felt it again. I think of this from time to time and wonder if maybe it was some sort of spiritual experience. I really don’t know but I’ve never met anyone else who has experienced this. Any thoughts? Any similar experiences???",human,plain_human,RAID,human,,reddit,ea7ceefc-e300-41b6-ab29-4606855c03b2,train,"{""source_id"": ""ea7ceefc-e300-41b6-ab29-4606855c03b2"", ""adv_source_id"": ""ea7ceefc-e300-41b6-ab29-4606855c03b2"", ""raid_attack_raw"": ""none"", ""raid_model_raw"": ""human""}"
