id,text,label,variant,source_dataset,generator_model,attack_type,domain,group_id,split,metadata
c4df26a4-7b1c-4367-afdf-9896c2a359d1,"Michal Grinstein-Weiss, PhD, MSW, MA, is the Shanti K. Khinduka Distinguished Professor at the George Warren Brown School of Social Work at Washington University in St. Louis where she is also serves as the Associate Dean for Policy Initiatives, the director of the university-wide Social Policy Institute, and the founding director of the Centene Center for Health Transformation. She serves as a nonresident senior fellow at the Brookings Institution. She previously held positions as a professor at the University of North Carolina at Chapel Hill where she established the Asset-Building Research Group. Education and academic career Dr. Grinstein-Weiss received her Ph.D. in social work at the Brown School at Washington University in St. Louis, her M.A. in economics from the University of Missouri, St. Louis, and her MSW and B.A. from Haifa University, Israel. After obtaining her PhD, she became a postdoctoral fellow at the Center for Social Development at Washington University in St. Louis and later joined University of North Carolina - Chapel Hill as a faculty member, where she founded the Asset-Building Research Group. In July 2012, Grinstein-Weiss merged her center with the Center for Social Development at Washington University in St. Louis. In 2015, she founded the Centene Center for Health Transformation, an industry-academic research collaboration with Fortune 100 company Centene Corporation.",human,plain_human,RAID,human,,wiki,c4df26a4-7b1c-4367-afdf-9896c2a359d1,train,"{""source_id"": ""c4df26a4-7b1c-4367-afdf-9896c2a359d1"", ""adv_source_id"": ""c4df26a4-7b1c-4367-afdf-9896c2a359d1"", ""raid_attack_raw"": ""none"", ""raid_model_raw"": ""human""}"
e5c1ef30-33da-4c31-a2da-94c8045c826e,"Philippe Sautet is a French chemist born on 8 May 1961 in Salon-de-Provence (France). He was elected to the French Academy of sciences on 30 November 2010. He was a research director at the CNRS and works in the chemistry laboratory of the École normale supérieure de Lyon where he devoted a large part of his scientific activity to molecular modelling. Now he is a professor at the University of California - Los Angeles. Biography Philippe Sautet is an engineer from the École polytechnique (Paris). He prepared his thesis at the University of Paris (Orsay) from 1985 to 1988 under the supervision of Odile Eisenstein. He was then a researcher at the CNRS in the Institut de Recherche sur la Catalyse (Villeurbanne, France) from 1988 to 1995, then Visiting Scientist at Lawrence Berkeley Laboratory (Berkeley, California) from 1991 to 1992. Upon his return from the United States, he was a lecturer and then professor at the École Polytechnique from 1993 to 2005. He then took over the management of UMR 5182 (Chemistry Laboratory of the École normale supérieure de Lyon, France) between 2003 and 2010. This is a research team of 80 people. He is also Director of the Institut de Chimie de Lyon, FR CNRS 3023 (1,000 people) since 2007.",human,plain_human,RAID,human,,wiki,e5c1ef30-33da-4c31-a2da-94c8045c826e,train,"{""source_id"": ""e5c1ef30-33da-4c31-a2da-94c8045c826e"", ""adv_source_id"": ""e5c1ef30-33da-4c31-a2da-94c8045c826e"", ""raid_attack_raw"": ""none"", ""raid_model_raw"": ""human""}"
55f8dda6-1fc1-4929-82db-157909175a88,"Kenneth ""Redneck"" Dement (February 13, 1933 – February 15, 2013) was an American football offensive tackle/defensive tackle. He played college football for Southeast Missouri State University. He was a 25th round selection (296th overall) selection by the New York Giants in the 1955 NFL Draft. But instead of playing professionally, Dement joined the United States Marines Corps where he achieved the rank of captain. After his military career, Dement went back to school, earning a law degree at Washington University School of Law in St. Louis. He returned to Sikeston, Missouri where he had grown up and began practicing law. From 1976 until 1981, he served on the Board of Regents for Southeast Missouri State University, including in the role as its president. Dement was once interviewed by Mike Wallace on 60 Minutes regarding a court case. He was elected to the College Football Hall of Fame in 1998. He had six children including one who preceded him in death. Dement died on February 15, 2013, in Cape Girardeau, Missouri. He was 80. References",human,plain_human,RAID,human,,wiki,55f8dda6-1fc1-4929-82db-157909175a88,train,"{""source_id"": ""55f8dda6-1fc1-4929-82db-157909175a88"", ""adv_source_id"": ""55f8dda6-1fc1-4929-82db-157909175a88"", ""raid_attack_raw"": ""none"", ""raid_model_raw"": ""human""}"
25ae5629-0c92-472a-9881-d6ede439e47a,"I leave for thee, beloved one, The home and friends of youth, Trusting my hopes, my happiness, Unto thy love and truth; I leave for thee my girlhood's joys, Its sunny, careless mirth, To bear henceforth my share amid The many cares of earth. And yet, no wild regret I give To all that now I leave, The golden dreams, the flow'ry wreaths That I no more may weave; The future that before me lies A dark and unknown sea -- Whate'er may be its storms or shoals, I brave them all with thee! I will not tell thee now of love Whose life, ere this, thou'st guessed, And which, like sacred secret, long Was treasured in my breast; Enough that if thy lot be calm, Or storms should o'er it sweep, Thou'lt learn that it is woman's love, Unchanging, pure and deep. If this life's sunshine gild thy lot, Bestowing wealth and pride, Its light enjoying, I shall stand, Rejoicing, at thy side; But, oh! if thou should'st prove the griefs That blight thy fellow-men, 'Twill be my highest, dearest right, To be, love, with thee then. And thou, wilt thou not promise me Thy heart will never change, That tones and looks, so loving now, Will ne'er grow stern and strange? That thou'lt be kind, whatever faults Or failings may be mine, And bear with them in patient love, As I will bear with thine?",human,plain_human,RAID,human,,poetry,25ae5629-0c92-472a-9881-d6ede439e47a,train,"{""source_id"": ""25ae5629-0c92-472a-9881-d6ede439e47a"", ""adv_source_id"": ""25ae5629-0c92-472a-9881-d6ede439e47a"", ""raid_attack_raw"": ""none"", ""raid_model_raw"": ""human""}"
885d2f08-8c21-4837-98f9-b61a99747592,"In this paper, firstly, by solving the Riemann problem of the zero-pressure flow in gas dynamics with a flux approximation, we construct parameterized delta-shock and constant density solutions, then we show that, as the flux perturbation vanishes, they converge to the delta-shock and vacuum state solutions of the zero-pressure flow, respectively. Secondly, we solve the Riemann problem of the Euler equations of isentropic gas dynamics with a double parameter flux approximation including pressure. Further we rigorously prove that, as the two-parameter flux perturbation vanishes, any Riemann solution containing two shock waves tends to a delta shock solution to the zero-pressure flow; any Riemann solution containing two rarefaction waves tends to a two-contact-discontinuity solution to the zero-pressure flow and the nonvacuum intermediate state in between tends to a vacuum state.",human,plain_human,RAID,human,,abstracts,885d2f08-8c21-4837-98f9-b61a99747592,train,"{""source_id"": ""885d2f08-8c21-4837-98f9-b61a99747592"", ""adv_source_id"": ""885d2f08-8c21-4837-98f9-b61a99747592"", ""raid_attack_raw"": ""none"", ""raid_model_raw"": ""human""}"
082bebd1-2b6b-4702-b82f-d09c82f8dda0,"Lockdown (2008) was a professional wrestling pay-per-view (PPV) event produced by the Total Nonstop Action Wrestling (TNA) promotion, which took place on April 13, 2008, at the Tsongas Arena in Lowell, Massachusetts. It was the fourth under the Lockdown chronology and fourth event in the 2008 TNA PPV schedule. Eight professional wrestling matches, two of which for championships, were featured on the card. In the tradition of Lockdown events, every match took place inside a six-sided steel structure known as the Six Sides of Steel. The main event was for the TNA World Heavyweight Championship between then-champion Kurt Angle and Samoa Joe, with the added stipulation if Joe lost he would retire from professional wrestling. Joe won the encounter, thus winning the TNA World Heavyweight Championship for the first time. Also held on the card was the 2008 Lethal Lockdown match between Team Cage and Team Tomko. Team Cage of Christian Cage, Matt Morgan, Kevin Nash, Rhino, and Sting defeated Tomko, A.J. Styles, James Storm, and Team 3D (Brother Devon and Brother Ray) of Team Tomko in the contest. Two featured bouts were scheduled on the undercard. The first was an Intergender Tag Team match pitting the team of Robert Roode and Payton Banks against the team of Booker T and Sharmell. Booker T and Sharmell were the victors in the match. The TNA X Division Championship was defended in the 2008 TNA Xscape match by Jay Lethal against Consequences Creed, Curry Man, Johnny Devine, Shark Boy, and Sonjay Dutt. Lethal won the competition to retain the championship.",human,plain_human,RAID,human,,wiki,082bebd1-2b6b-4702-b82f-d09c82f8dda0,train,"{""source_id"": ""082bebd1-2b6b-4702-b82f-d09c82f8dda0"", ""adv_source_id"": ""082bebd1-2b6b-4702-b82f-d09c82f8dda0"", ""raid_attack_raw"": ""none"", ""raid_model_raw"": ""human""}"
5df29fbd-7ab0-4de6-a5a8-dcc77186a616,"Colossae (; Greek: Κολοσσαί) was an ancient city of Phrygia in Asia Minor, and one of the most celebrated cities of southern Anatolia (modern Turkey). The Epistle to the Colossians, an early Christian text which identifies its author as Paul the Apostle, is addressed to the church in Colossae. A significant city from the 5th century BC onwards, it had dwindled in importance by the time of Paul, but was notable for the existence of its local angel cult. It was part of the Roman – and then Byzantine – province of Phrygia Pacatiana, before being destroyed in 1192/3 and its population relocating to nearby Chonae (Chonai, modern day Honaz). Location and geography Colossae was located in Phrygia, in Asia Minor. It was located 15 km southeast of Laodicea on the road through the Lycus Valley near the Lycus River at the foot of Mt. Cadmus, the highest mountain in Turkey's western Aegean Region, and between the cities Sardeis and Celaenae, and southeast of the ancient city of Hierapolis. At Colossae, Herodotus describes how, ""the river Lycos falls into an opening of the earth and disappears from view, and then after an interval of about five furlongs it comes up to view again, and this river also flows into the Maiander."" Despite a treacherously ambiguous cartography and history, Colossae has been clearly distinguished in modern research from nearby Chonai (Χῶναι), now called Honaz, with what remains of the buried ruins of Colossae (""the mound"") lying 3 km to the north of Honaz.",human,plain_human,RAID,human,,wiki,5df29fbd-7ab0-4de6-a5a8-dcc77186a616,train,"{""source_id"": ""5df29fbd-7ab0-4de6-a5a8-dcc77186a616"", ""adv_source_id"": ""5df29fbd-7ab0-4de6-a5a8-dcc77186a616"", ""raid_attack_raw"": ""none"", ""raid_model_raw"": ""human""}"
f7a41a4a-a60b-4938-b660-be6ebeb6737d,"1 1/2 cups white sugar 1 cup butter 1/2 cup milk 1/2 cup unsweetened cocoa powder 4 eggs 2 cups all-purpose flour 1/2 teaspoon baking soda Turn on a multi-functional pressure cooker (such as Instant Pot(R)) and select Saute function. Add sugar and butter to the pot; stir until butter melts, about 5 minutes. Add milk and cocoa powder. Whisk until smooth and starting to bubble, about 5 minutes. Remove pot and let chocolate mixture cool, 5 to 10 minutes. Pour 1/2 cup chocolate mixture into a small bowl. Reserve for drizzling over the cake. Whisk eggs, one at a time, into the remaining chocolate mixture in the pot. Add flour and baking soda; mix thoroughly. Return pot to the cooker. Close and lock lid. Select Cake function according to manufacturer's instructions. Set timer for 30 minutes. Allow 10 to 15 minutes for pressure to build. Switch to Warm function after timer goes off. Set timer for 30 minutes. Unlock and remove lid; lift out pot. Run a knife around the sides of the pot to release cake. Place a serving plate on top. Invert cake onto the serving plate. Poke holes in the cake with a toothpick or sharp knife. Drizzle reserved chocolate mixture slowly over the cake, letting it absorb the chocolate.",human,plain_human,RAID,human,,recipes,f7a41a4a-a60b-4938-b660-be6ebeb6737d,train,"{""source_id"": ""f7a41a4a-a60b-4938-b660-be6ebeb6737d"", ""adv_source_id"": ""f7a41a4a-a60b-4938-b660-be6ebeb6737d"", ""raid_attack_raw"": ""none"", ""raid_model_raw"": ""human""}"
bc9f9b82-cae8-49c9-abc5-ee24e38a37e0,"So I’ve been pretty excited with all the Disney Villainous expansions that we have gotten and will get but I’m kinda curious if Ravensburger have future plans on doing Pixar Villainous. Since Disney owns Pixar I was thinking it would be really cool to see they’re take on how the Pixar Villains will win. Obviously I feel there’s a few Villains for I think would be really amazing to see. For example, Mister Waternoose from Monsters Inc. His goal could be literally be to scare Boo enough times to fill up a certain number of canisters with her screams, as well as having ally cards be Randal and other scare monsters from the floor. Also it would be cool to give Hopper from Bug’s Life a chance to throw down. As we known he’s main goal is to make the worker ants bring him enough food to survive the winter. It would be pretty cool to see how the circus troop play out against him in the game. Another villain that would be interesting to see from Pixar universe is AUTO from WALL-E. I love WALL-E and and nothing would scream crazy villain like an ai computer forcing the main kind to be lazy and to give up on returning back to earth. AUTO goal could be to obtain the plant and try to destroy it. Ideally there are many villains that could appear if they ever did a Pixar edition to of Disney Villainous, but will we ever see it come to fruition? Who would you think would be interesting to see from the Pixar world entering into the Villainous board game world?",human,plain_human,RAID,human,,reddit,bc9f9b82-cae8-49c9-abc5-ee24e38a37e0,train,"{""source_id"": ""bc9f9b82-cae8-49c9-abc5-ee24e38a37e0"", ""adv_source_id"": ""bc9f9b82-cae8-49c9-abc5-ee24e38a37e0"", ""raid_attack_raw"": ""none"", ""raid_model_raw"": ""human""}"
13c47146-948e-416b-9b74-5c84a6ab9fa6,"Talsu spends a few months in a Jelgavan jail, and coupled with Skarnu's adventures, makes it clear that many Valmierans and Jelgavans support Algarve. Algarvians strike at the Naantali Project, killing Siuntio. Gyongyos loses more islands to Kuusamo and Istvan's unit is moved from Unkerlant to the island of Becsehely. Algarvians try to pinch off Unkerlanters in Durrwangen using everything they have, leading to the Battle of Durrwangen. Most surviving Kaunians in Forthweg now use Vanai's Forthwegian disguise, and Algarvians are unable to catch nearly as many as before. Algarvian progress in the summer against Durrwangen very slow, and Unkerlanters battle them to a standstill, then force them back into Grelz, ultimately overrunning the capital Herborn. Raniero, the puppet king of Grelz, is boiled in a pot by Swemmel. Sibiu liberated by Lagoas and Kuusamo, and Cornelu is poisoned by his wife, who is sentenced to beheading. Garivald finds his village and family annihilated by the fighting. Vanai ends up caught by the Algarvians.",human,plain_human,RAID,human,,books,13c47146-948e-416b-9b74-5c84a6ab9fa6,train,"{""source_id"": ""13c47146-948e-416b-9b74-5c84a6ab9fa6"", ""adv_source_id"": ""13c47146-948e-416b-9b74-5c84a6ab9fa6"", ""raid_attack_raw"": ""none"", ""raid_model_raw"": ""human""}"
e3b623ee-905d-4658-b285-a912b787695b,"2 Tablespoons Olive Oil 6 ounces, weight Andouille Chicken Sausage, Diced 1/2 whole Spanish Onion, Diced 1/2 whole Each Of Green, Yellow And Red Bell Pepper, Stem And Seeds Removed, Diced 2 cloves Garlic, Minced 1 can (14 1/2 Oz. Size) Diced Fire Roasted Tomatoes 1 Tablespoon Plus 1 Teaspoon Smoked Paprika 1 teaspoon Oregano 3/4 teaspoons Cumin 1 pinch Cayenne Pepper 1- 1/4 cup Brown Rice 3- 1/2 cups Low Sodium Chicken Stock 1 pound Large Shrimp, Peeled And Deveined 4 whole Scallions, Thinly Sliced 1/4 cups Fresh Cilantro, Chopped Heat the olive oil in a Dutch oven or large saucepan over medium heat. When hot, add the diced chicken sausage and saute for about 4 minutes until lightly browned. Add the onion, bell peppers and garlic and cook for 3 minutes until the vegetables are just tender and the garlic is fragrant. Add the diced fire roasted tomatoes, smoked paprika, oregano, cumin and cayenne pepper and cook for about 3 minutes until the mixture is simmering. Mix in the brown rice and cook for 1 minute before adding the chicken stock. Bring to a boil and then lower heat to a simmer. Cover and cook for 50 minutes until the rice is tender and most of the liquid has been absorbed. Taste your jambalaya, and season with salt and a little extra cayenne if youre into spicy. Mix the shrimp into your jambalaya, cover and cook for 5 minutes until the shrimp are cooked through. Cooked shrimp are bright pink and opaque. Ladle the jambalaya into bowls and garnish with sliced scallions and chopped cilantro. Serve with your fanciest hot sauce and go wild.",human,plain_human,RAID,human,,recipes,e3b623ee-905d-4658-b285-a912b787695b,train,"{""source_id"": ""e3b623ee-905d-4658-b285-a912b787695b"", ""adv_source_id"": ""e3b623ee-905d-4658-b285-a912b787695b"", ""raid_attack_raw"": ""none"", ""raid_model_raw"": ""human""}"
998ce716-fe52-477a-b4eb-4ad9c360092a,"The Deed of Paksenarrion was written as one long story, but published as three separate books. A number of people have pointed out resemblances between the story setting and Dungeons & Dragons, in particular alleged similarities between Moon's town of Brewersbridge and Hommlet (a village in The Temple of Elemental Evil module for AD&D) and between Moon's religion of Gird and the faith of Saint Cuthbert of the Cudgel in Greyhawk. However, such themes may often be similarly found in many brands of high fantasy, and are not unique to any one fictional world. The Deed of Paksenarrion revolves around the adult life of Paksenarrion Dorthansdotter, known as Paks, of Three Firs. It takes place in a fictional medieval world of kingdoms of humans, dwarves, gnomes and elves. The story begins by introducing Paks as a headstrong girl of 18, who leaves her home in Three Firs (fleeing a marriage arranged by her father) to join a mercenary company and through her journeys and hardships comes to realize that she has been gifted as a paladin, if in a rather non-traditional way.",human,plain_human,RAID,human,,books,998ce716-fe52-477a-b4eb-4ad9c360092a,train,"{""source_id"": ""998ce716-fe52-477a-b4eb-4ad9c360092a"", ""adv_source_id"": ""998ce716-fe52-477a-b4eb-4ad9c360092a"", ""raid_attack_raw"": ""none"", ""raid_model_raw"": ""human""}"
