id,text,label,variant,source_dataset,generator_model,attack_type,domain,group_id,split,metadata
88c1e961-d5b9-4c0b-aac1-344669484c07,"I'm supposedly a very intelligent person according to my teachers throughout my life and according to my scores on standardized tests. However, I feel I have cheated the system to get those grades. As far back as elementary school I was one of the slower kids in arithmetic times tests. I eventually was given a 504 plan for ADD and so got extra time on tests. This gave me extra time on exams. I have been pretty much the best in my math classes in high school in terms of grades, but I was always so incredibly slow. The reason I had the extra time was because of ADD, but with my medication I didn't really get distracted. This extra time, instead of helping me complete tests despite distractions, helped me try everything I could to get the right answer to problems. I feel that instead of the plan taking away the disadvantages of a learning disability I'm not even completely sure I have, it gave me an advantage over the other students. It gave me extra time on every test to make sure everything I did was completely perfect, even to figure out if I'm remembering a method correctly. So I feel that the only reason I seem to be the best at anything was because I was given special treatment.",human,plain_human,RAID,human,,reddit,88c1e961-d5b9-4c0b-aac1-344669484c07,train,"{""source_id"": ""88c1e961-d5b9-4c0b-aac1-344669484c07"", ""adv_source_id"": ""88c1e961-d5b9-4c0b-aac1-344669484c07"", ""raid_attack_raw"": ""none"", ""raid_model_raw"": ""human""}"
5ef3f87a-e35b-4a5c-94a0-2fc88baab20b,"Your eyes in my heart, vast, deep, bluish, a sweet breeze now touches the brain, heart, mind and soul, alluring lips whisper in my ears again the depth of your love as the stars dappled stream flows not disturbing anybody reflecting its beauty ever, wings of love, beauty and eternity merge into one, when? from where? I don't know, sure, I have got a bit of soft spot for you and the apple of your eyes, now, the ring on your little finger, giggling bangles encircling the wrist, light green vein on your soft hand near the silver wrist watch, swaying earrings stroking the cheek appear more beautiful, birds, flowers, butterflies, life on the earth, grass, galaxies, time and infinity, my mind recollects all these... Moses and Ten Commandments, the Bible, the Qur'an, the Gita... rationalists, communists, atheists... Darwin, Freud, Newton, Magellan, Copernicus, Shakespeare, Van Gogh, Charles Chaplin, E equals MC squared, cloning, IT... pianissimo, play on... dreams... an innocent smile on the face of a child, tears of a neglected old mother, a rose lying near the tomb in silence with scattered tears on the petals, sleep, death, darkness... why did I come here? who sent me here? where am I going after death? there is life beyond the grave? for whom do I wake up in the morning? why the creations are in pairs: male and female? why does nature bind me with your eyes? why does nature allow your eyes to pierce me so deep? two doves ruffle their feathers on the branches near the green leaves, the sky kisses the ocean making ripples and waves on its breast, electrons keep their smartness near the protons, day and night play hide and seek, Tajmahal blazes in the evening rays pulsating the loveever... the stars wink at each other during theirtravel in the space, moonlight touches the petals of lotus in romance, now the pregnant clouds pour, the flowers and fruits delight the soul, now, no prejudices, no narrow domestic walls, but love your eyes vast, deep, bluish...",human,plain_human,RAID,human,,poetry,5ef3f87a-e35b-4a5c-94a0-2fc88baab20b,train,"{""source_id"": ""5ef3f87a-e35b-4a5c-94a0-2fc88baab20b"", ""adv_source_id"": ""5ef3f87a-e35b-4a5c-94a0-2fc88baab20b"", ""raid_attack_raw"": ""none"", ""raid_model_raw"": ""human""}"
23b496ec-bdb5-4888-9006-38db22640bfa,"The story opens on the island of Saint-Domingue (current day Haiti) in the late 18th century. Zarite (known as Tete) is the daughter of an African mother she never knew and one of the white sailors who brought her into bondage. As a young girl Tete is purchased by Violette, a mixed race courtesan, on behalf of Toulouse Valmorain, a Frenchman who has inherited his father's sugar plantation. Valmorain has big dreams of financial success and is somewhat ambivalent towards slavery. He views it as a means to an end, as he does most things. Upon Valmorain's marriage, Tete becomes his wife's personal slave. Valmorain's wife is fragile, beautiful, and slowly succumbs to madness. As Valmorain's wife goes mad, Valmorain forces Tete, now a teenager, into sexual servitude, which produces several illegitimate children. Spanning four decades, the narrative leaps between the social upheavals from the distant French Revolution to the Haitian slave rebellion in all its brutality and chaos, to a New Orleans fomenting with cultural change.",human,plain_human,RAID,human,,books,23b496ec-bdb5-4888-9006-38db22640bfa,train,"{""source_id"": ""23b496ec-bdb5-4888-9006-38db22640bfa"", ""adv_source_id"": ""23b496ec-bdb5-4888-9006-38db22640bfa"", ""raid_attack_raw"": ""none"", ""raid_model_raw"": ""human""}"
32c4629f-ca6d-48a0-bddd-77fd85c8341f,"Clustering is an unsupervised machine learning method grouping data samples into clusters of similar objects. In practice, clustering has been used in numerous applications such as banking customers profiling, document retrieval, image segmentation, and e-commerce recommendation engines. However, the existing clustering techniques present significant limitations, from which is the dependability of their stability on the initialization parameters (e.g. number of clusters, centroids). Different solutions were presented in the literature to overcome this limitation (i.e. internal and external validation metrics). However, these solutions require high computational complexity and memory consumption, especially when dealing with big data. In this paper, we apply the recent object detection Deep Learning (DL) model, named YOLO-v5, to detect the initial clustering parameters such as the number of clusters with their sizes and centroids. Mainly, the proposed solution consists of adding a DL-based initialization phase making the clustering algorithms free of initialization. Two model solutions are provided in this work, one for isolated clusters and the other one for overlapping clusters. The features of the incoming dataset determine which model to use. Moreover, The results show that the proposed solution can provide near-optimal clusters initialization parameters with low computational and resources overhead compared to existing solutions.",human,plain_human,RAID,human,,abstracts,32c4629f-ca6d-48a0-bddd-77fd85c8341f,train,"{""source_id"": ""32c4629f-ca6d-48a0-bddd-77fd85c8341f"", ""adv_source_id"": ""32c4629f-ca6d-48a0-bddd-77fd85c8341f"", ""raid_attack_raw"": ""none"", ""raid_model_raw"": ""human""}"
f0fc498f-301b-4170-8f75-f9478dcc9bc2,"Nintendo's DS handheld game console has officially gone on sale in Europe. Many stores around the UK opened at midnight to let keen gamers get their hands on the device. The two-screen clamshell gadget costs £99 (149 euros) and 15 games are available for it at launch, some featuring well-known characters such as Super Mario and Rayman. The DS spearheads Nintendo's attempt to continue its dominance of the handheld gaming market. Since going on sale in Japan and the US at the end of 2004, Nintendo has sold almost 4m DS consoles. Part of this popularity may be due to the fact that the DS can run any of the catalogue of 700 games produced for Nintendo's GameBoy Advance handheld. Games for the DS are expected to cost between £19 and £29. About 130 games for the DS are in development. As well as having two screens, one of which is controlled by touch, the DS also lets players take on up to 16 other people via wireless. A ""download play"" option means DS owners can take each other on even if only one of them owns a copy of a particular game. Other DS owners can also be sent text messages and drawings. Nintendo is also planning to release a media adapter for the handheld so it can play music and video. Five Virgin megastores and 150 Game shops were expected to open early on Friday morning to let people buy a DS. ""We know that customers want it as soon as it's released - and that means the minute, not the day,"" said Robert Quinn, Game's UK sales director. But Nintendo will only have sole control of Europe's handheld gaming market for a few weeks because soon Sony is expected to release its PSP console. Although Nintendo is aiming for younger players and the PSP is more for older gamers, it is likely that the two firms will be competing for many of the same customers. Sony's PSP represents a real threat to Nintendo because of the huge number of PlayStation owners around the world and the greater flexibility of the sleek black gadget. The PSP uses small discs for games, can play music and movies without the need for add-ons and also supports short-range wireless play. When it goes on sale the PSP is likely to cost between £130 and £200.",human,plain_human,RAID,human,,news,f0fc498f-301b-4170-8f75-f9478dcc9bc2,train,"{""source_id"": ""f0fc498f-301b-4170-8f75-f9478dcc9bc2"", ""adv_source_id"": ""f0fc498f-301b-4170-8f75-f9478dcc9bc2"", ""raid_attack_raw"": ""none"", ""raid_model_raw"": ""human""}"
04d3809c-0abe-4bee-b1d2-9787af95362f,"We introduce a method that allows to automatically segment images into semantically meaningful regions without human supervision. Derived regions are consistent across different images and coincide with human-defined semantic classes on some datasets. In cases where semantic regions might be hard for human to define and consistently label, our method is still able to find meaningful and consistent semantic classes. In our work, we use pretrained StyleGAN2~\cite{karras2020analyzing} generative model: clustering in the feature space of the generative model allows to discover semantic classes. Once classes are discovered, a synthetic dataset with generated images and corresponding segmentation masks can be created. After that a segmentation model is trained on the synthetic dataset and is able to generalize to real images. Additionally, by using CLIP~\cite{radford2021learning} we are able to use prompts defined in a natural language to discover some desired semantic classes. We test our method on publicly available datasets and show state-of-the-art results.",human,plain_human,RAID,human,,abstracts,04d3809c-0abe-4bee-b1d2-9787af95362f,train,"{""source_id"": ""04d3809c-0abe-4bee-b1d2-9787af95362f"", ""adv_source_id"": ""04d3809c-0abe-4bee-b1d2-9787af95362f"", ""raid_attack_raw"": ""none"", ""raid_model_raw"": ""human""}"
9c710a37-8224-47b7-a739-4fb3c2fa7b27,"Jeff Langton (born December 11, 1956) is an American actor and martial arts performer and practitioner. He is also a professional boxing trainer, cornerman, and cutman. Early life Jeff was born in Pasadena, California and raised between San Jose, California and Brooklyn, New York. His father was a member of the Marine Corps Boxing Team and later trained young Langton in the ""sweet science."" When Langton was 13, he joined the Police Athletic League and trained as an amateur boxer with Gus Spencer. He also trained at Garden City Boxing Club and Bath Beach Health Club in Brooklyn New York. As a young man he also trained in martial arts as well as boxing. He trained in Tae Kwon Do with Dan Kyu Choi. He became the captain of Choi's Institute of Tae Kwon Do Championship Team and then went on to be California State Tae Kwon Do Champion. He also received a black belt in Tae Kwon Do from Master Byung Yu. He was also the first and original member of the world-famous Ernie Reyes West Coast Demo Team and introduced gymnastics and acrobatics to martial arts demonstration. This legacy continues on, as the format Langton introduced is still used today by West Coast Demo Team in shows all around the world.",human,plain_human,RAID,human,,wiki,9c710a37-8224-47b7-a739-4fb3c2fa7b27,train,"{""source_id"": ""9c710a37-8224-47b7-a739-4fb3c2fa7b27"", ""adv_source_id"": ""9c710a37-8224-47b7-a739-4fb3c2fa7b27"", ""raid_attack_raw"": ""none"", ""raid_model_raw"": ""human""}"
66eb4cc1-dbef-45a7-b560-4eec07254d1f,"Charles Brendan Grandy (born March 5, 1974) is an American stand-up comedian, television writer and producer. He began his career on the television series The Daily Show with Jon Stewart, Saturday Night Live, The Office, and Guys With Kids. Grandy has had a string of collaborations with actress and producer Mindy Kaling through The Mindy Project, Champions, and Four Weddings and a Funeral. He is the son of former Love Boat star turned politician Fred Grandy. Career After working as a stand-up comedian, Grandy turned to television writing and became a writer on Jon Stewart's The Daily Show in 2001. After his Daily Show stint, Grandy became a writer and producer on Saturday Night Live, where he worked until 2008. He worked on the Weekend Update sketch. In the same year, he joined the writing staff of the fifth season of the American version of The Office. At the beginning of the sixth season he became a co-producer and by the time the show entered its seventh season, he had become a supervising producer of the series. After the cancellation of his show, Guys With Kids, he joined his former Office cohort, Mindy Kaling, on the second season of her show, The Mindy Project, as a writer and co-executive producer. In 2018, Grandy and Kaling created the NBC show Champions. He served as an executive producer on Kaling's 2019 miniseries Four Weddings and a Funeral.",human,plain_human,RAID,human,,wiki,66eb4cc1-dbef-45a7-b560-4eec07254d1f,train,"{""source_id"": ""66eb4cc1-dbef-45a7-b560-4eec07254d1f"", ""adv_source_id"": ""66eb4cc1-dbef-45a7-b560-4eec07254d1f"", ""raid_attack_raw"": ""none"", ""raid_model_raw"": ""human""}"
8524f7c8-a52c-41bf-9872-c3dbc30dee4b,"Ten miles down Reedy River A pool of water lies, And all the year it mirrors The changes in the skies, And in that pool's broad bosom Is room for all the stars; Its bed of sand has drifted O'er countless rocky bars. Around the lower edges There waves a bed of reeds, Where water rats are hidden And where the wild duck breeds; And grassy slopes rise gently To ridges long and low, Where groves of wattle flourish And native bluebells grow. Beneath the granite ridges The eye may just discern Where Rocky Creek emerges From deep green banks of fern; And standing tall between them, The grassy she-oaks cool The hard, blue-tinted waters Before they reach the pool. Ten miles down Reedy River One Sunday afternoon, I rode with Mary Campbell To that broad, bright lagoon; We left our horses grazing Till shadows climbed the peak, And strolled beneath the she-oaks On the banks of Rocky Creek. Then home along the river That night we rode a race, And the moonlight lent a glory To Mary Campbell's face; And I pleaded for our future All through that moonlight ride, Until our weary horses Drew closer side by side. Ten miles from Ryan's Crossing And five miles below the peak, I built a little homestead On the banks of Rocky Creek; I cleared the land and fenced it And ploughed the rich, red loam, And my first crop was golden When I brought my Mary home. Now still down Reedy River The grassy she-oaks sigh, And the water-holes still mirror The pictures in the sky; And over all for ever Go sun and moon and stars, While the golden sand is drifting Across the rocky bars But of the hut I builded There are no traces now. And many rains have levelled The furrows of the plough; And my bright days are olden, For the twisted branches wave And the wattle blossoms golden On the hill by Mary's grave.",human,plain_human,RAID,human,,poetry,8524f7c8-a52c-41bf-9872-c3dbc30dee4b,train,"{""source_id"": ""8524f7c8-a52c-41bf-9872-c3dbc30dee4b"", ""adv_source_id"": ""8524f7c8-a52c-41bf-9872-c3dbc30dee4b"", ""raid_attack_raw"": ""none"", ""raid_model_raw"": ""human""}"
6ee11d77-0a5f-49a8-8b76-df91ad37d6a8,"""Glory"" is a modern film classic that highlights a little-known chapter of the Civil War.<br/><br/>I recently purchased the DVD, and was just as moved (if not more so) as the first time I saw it.<br/><br/>Broderick, Freeman, and Washington, along with a stellar cast play it faultlessly. I still remember the brouhaha over the casting of Matthew Broderick as Shaw, and I see that even now some IMDb posters single him out for fault in ""Glory."" Sorry, but I disagree. One should remember that the real Col. Shaw was a young man in his mid-20s - hardly a grizzled old veteran - despite his high rank. Broderick actually does bear a resemblance to Shaw, and shouldn't be criticized for his boyish looks. I felt every nuance of the burden he carried, and thought Broderick did a wonderful job.<br/><br/>Denzel Washington's powerful acting may never again have a showcase like it did in ""Glory."" His beauty, rage, and pride scream in every frame. His Oscar for this break-out role was highly deserved. Trip's character is really the distillation of what this film is all about: the black man's heart-rending battle for worth, recognition, and dignity. As far as I'm concerned no one BUT Washington could have played Trip. Thank God for Denzel!<br/><br/>Morgan Freeman is the film's human core. His quiet compassion and leadership keeps the soldiers focused. His one angry confrontation with Trip proves he has the goods to back up a field promotion to Sergeant Major.<br/><br/>Freeman (an appropriate reminder of where surnames come from) is the father figure the regiment desperately needs in a time of death and crisis. The men look to him for his calming wisdom and reasonable, fair demeanor.<br/><br/>Films like ""Saving Private Ryan"" raised the technical bar for battle scenes.<br/><br/>The fighting scenes in ""Glory"" are, unfortunately, it's weakest element. The staging and choreography are mediocre at best. And other than a scene where the 54th Massachusetts is given a hero's flanking onto the battlefield beaches of South Carolina, these shots don't emotionally engage the viewer. Still, in the end, ""Glory"" isn't about big, noisy battles. It's about the transcendence of the human spirit in the face of bigotry, bad treatment, and almost certain death. It's about a watershed moment in our bloody history that elevated us all and must never be forgotten.<br/><br/>""Glory"" is, indeed, glorious.",human,plain_human,RAID,human,,reviews,6ee11d77-0a5f-49a8-8b76-df91ad37d6a8,train,"{""source_id"": ""6ee11d77-0a5f-49a8-8b76-df91ad37d6a8"", ""adv_source_id"": ""6ee11d77-0a5f-49a8-8b76-df91ad37d6a8"", ""raid_attack_raw"": ""none"", ""raid_model_raw"": ""human""}"
043cc763-6197-4b20-aef1-36318e8f446f,"Jan-Ove Waldner (; born 3 October 1965), in Sweden commonly J-O Waldner (, is a Swedish former table tennis player. He is often referred to as ""the Mozart of table tennis."" A sporting legend in his native Sweden as well as in China, he is known in China as 老瓦 Lǎo Wǎ (""Elder Waldner"") or 常青树 Cháng Qīng Shù (""Evergreen Tree""), because of his extraordinary longevity and competitiveness. As of July 2021, he is the only person to win an Olympic table tennis gold medal representing a non-Asian country. Biography Jan-Ove Waldner was born in Stockholm on 3 October 1965. His athletic potential was recognised at an early age and was displayed in 1982 when, as a 16-year-old, he reached the final of the European Championships, losing to distinguished left-handed teammate Mikael Appelgren, who was perceived then as the logical successor to the first Swedish World Champion, Stellan Bengtsson. While still developing his game, Waldner, along with several other Swedish players, traveled to a national-level training camp held in China, and was reportedly amazed by the dedication and solidarity of the Chinese players. He has claimed ever since that he learned much during his stay, and thereafter first began to regard his opportunity to succeed in table tennis as paramount.",human,plain_human,RAID,human,,wiki,043cc763-6197-4b20-aef1-36318e8f446f,train,"{""source_id"": ""043cc763-6197-4b20-aef1-36318e8f446f"", ""adv_source_id"": ""043cc763-6197-4b20-aef1-36318e8f446f"", ""raid_attack_raw"": ""none"", ""raid_model_raw"": ""human""}"
897fdbe3-cc9e-41ce-a133-ec03cb2303e2,"In this paper, we present a new image segmentation method based on the concept of sparse subset selection. Starting with an over-segmentation, we adopt local spectral histogram features to encode the visual information of the small segments into high-dimensional vectors, called superpixel features. Then, the superpixel features are fed into a novel convex model which efficiently leverages the features to group the superpixels into a proper number of coherent regions. Our model automatically determines the optimal number of coherent regions and superpixels assignment to shape final segments. To solve our model, we propose a numerical algorithm based on the alternating direction method of multipliers (ADMM), whose iterations consist of two highly parallelizable sub-problems. We show each sub-problem enjoys closed-form solution which makes the ADMM iterations computationally very efficient. Extensive experiments on benchmark image segmentation datasets demonstrate that our proposed method in combination with an over-segmentation can provide high quality and competitive results compared to the existing state-of-the-art methods.",human,plain_human,RAID,human,,abstracts,897fdbe3-cc9e-41ce-a133-ec03cb2303e2,train,"{""source_id"": ""897fdbe3-cc9e-41ce-a133-ec03cb2303e2"", ""adv_source_id"": ""897fdbe3-cc9e-41ce-a133-ec03cb2303e2"", ""raid_attack_raw"": ""none"", ""raid_model_raw"": ""human""}"
a75502b4-5b9a-4a96-b494-67f3f42568b6,"In the border shantytown of Ysleta, Texas, Mexican immigrants Pilar and Cuauhtemoc Martinez strive to teach their four children to forsake the drugs and gangs of their neighborhood. The family’s hardscrabble origins unite them to survive, but soon the children adapt to their new home, reject their traditional religion and culture, and struggle to remain together as a family. The novel spans four decades. As a young adult, daughter Julieta travels to Central America, becomes disenchanted with Catholicism, and converts to Islam. Youngest son Ismael, always the bookworm, is accepted to Harvard but feels out of place in the Northeast, where he meets and marries a Jewish woman. The other boys--Marcos and Francisco--toil in their father’s old apartment buildings, serving as cheap labor to fuel the family’s rise to the middle class. Over time, Francisco isolates himself in El Paso. Marcos eventually leaves to become a teacher, but then returns, struggling with a deep bitterness about his work and marriage. Through it all, Pilar clings to the idea of her family and tries to hold it together as her husband’s health begins to fail. This backdrop is shaken to its core by the historic events of 2001 in New York City, which send shockwaves through this newly American family. Bitter conflicts erupt between siblings, and the physical and cultural spaces between them threaten to tear them apart. Will their shared history and once-shared dreams be enough to hold together a family from Ysleta, this wicked patch of dust?",human,plain_human,RAID,human,,books,a75502b4-5b9a-4a96-b494-67f3f42568b6,train,"{""source_id"": ""a75502b4-5b9a-4a96-b494-67f3f42568b6"", ""adv_source_id"": ""a75502b4-5b9a-4a96-b494-67f3f42568b6"", ""raid_attack_raw"": ""none"", ""raid_model_raw"": ""human""}"
141c01ea-bf25-4b75-b35c-7279a95ad394,"THE moments passed as at a play; I had the wisdom love brings forth; I had my share of mother-wit, And yet for all that I could say, And though I had her praise for it, A cloud blown from the cut-throat North Suddenly hid Love's moon away. Believing every word I said, I praised her body and her mind Till pride had made her eyes grow bright, And pleasure made her cheeks grow red, And vanity her footfall light, Yet we, for all that praise, could find Nothing but darkness overhead. We sat as silent as a stone, We knew, though she'd not said a word, That even the best of love must die, And had been savagely undone Were it not that Love upon the cry Of a most ridiculous little bird Tore from the clouds his marvellous moon. ALTHOUGH crowds gathered once if she but showed her face, And even old men's eyes grew dim, this hand alone, Like some last courtier at a gypsy camping-place Babbling of fallen majesty, records what's gone. These lineaments, a heart that laughter has made sweet, These, these remain, but I record what-s gone. A crowd Will gather, and not know it walks the very street Whereon a thing once walked that seemed a burning cloud",human,plain_human,RAID,human,,poetry,141c01ea-bf25-4b75-b35c-7279a95ad394,train,"{""source_id"": ""141c01ea-bf25-4b75-b35c-7279a95ad394"", ""adv_source_id"": ""141c01ea-bf25-4b75-b35c-7279a95ad394"", ""raid_attack_raw"": ""none"", ""raid_model_raw"": ""human""}"
